{"authority":"Emotional","birth":{"date":"2024-11-03","time":"01:30","timezone":"America/New_York"},"definition":"Triple Split Definition","location":{"lat":"40.712800","lng":"-74.006000","name":"New York, USA"},"mechanics":{"centers":[{"id":"head","state":"defined"},{"id":"ajna","state":"defined"},{"id":"throat","state":"defined"},{"id":"g","state":"undefined"},{"id":"ego","state":"defined"},{"id":"spleen","state":"defined"},{"id":"solar_plexus","state":"defined"},{"id":"sacral","state":"undefined"},{"id":"root","state":"undefined"}],"channels":["04-63","26-44","35-36"],"gates":["04","07","08","13","14","16","17","18","22","24","25","26","34","35","36","44","45","56","59","60","63"]},"schema":"chart.normalized.v1","source":"hdapi","type":"Manifestor"}
